{
  "$schema": "http://json-schema.org/draft-07/schema#",
  "title": "Kestrel version lists",
  "type": "object",
  "additionalProperties": false,
  "required": ["schemaVersion", "dataStatus", "retrievedAt", "tools"],
  "properties": {
    "$schema": { "type": "string" },
    "schemaVersion": { "const": 1 },
    "dataStatus": { "enum": ["sample", "refreshed"] },
    "retrievedAt": {
      "anyOf": [
        { "type": "null" },
        { "type": "string", "pattern": "^\\d{4}-\\d{2}-\\d{2}$" }
      ]
    },
    "note": { "type": "string", "maxLength": 400 },
    "tools": {
      "type": "object",
      "propertyNames": { "pattern": "^[a-z][a-z0-9-]{0,39}$" },
      "additionalProperties": {
        "type": "object",
        "additionalProperties": false,
        "required": ["versions"],
        "properties": {
          "versions": {
            "type": "array",
            "minItems": 1,
            "items": {
              "type": "object",
              "additionalProperties": false,
              "required": ["version"],
              "properties": {
                "version": {
                  "type": "string",
                  "pattern": "^[0-9]+(\\.[0-9]+){0,2}$|^[0-9]+(\\.[0-9]+)?\\.x$"
                }
              }
            }
          }
        }
      }
    }
  }
}